<?xml version="1.0" encoding="UTF-8"?>
<!DOCTYPE weather_data SYSTEM "weather-data-daily.dtd"> <!-- Old DOCTYPE definition necessary because parser of python module `lxml` can only validate a xml over a DTD when its defined with DOCTYPE -->
<weather_data>
    <station_number>
        <Longitude></Longitude>
        <Latitude></Latitude>
        <Version_Number_OF_Stations_Datalogger_Program></Version_Number_OF_Stations_Datalogger_Program>
        <UTC_Date>
            <Temperature>
                <Max_Air_Temperature></Max_Air_Temperature>
                <Min_Air_Temperature></Min_Air_Temperature>
                <Mean_Air_Temperature></Mean_Air_Temperature>
                <Avg_Air_Temperature></Avg_Air_Temperature>
            </Temperature>
            <Precipitation></Precipitation>
            <Total_Solar_Energy></Total_Solar_Energy>
            <Infrared_Surface_Temperature_Type>
                <Max_Infrared_Temperature></Max_Infrared_Temperature>
                <Min_Infrared_Temperature></Min_Infrared_Temperature>
                <Avg_Infrared_Temperature></Avg_Infrared_Temperature>
            </Infrared_Surface_Temperature_Type>
            <RH>
                <Avg_RH></Avg_RH>
                <Max_RH></Max_RH>
                <Min_RH></Min_RH>
            </RH>
            <Soil_Moisture>
                <Avg_Soil_Moisture_5_cm_below></Avg_Soil_Moisture_5_cm_below>
                <Avg_Soil_Moisture_10_cm_below></Avg_Soil_Moisture_10_cm_below>
                <Avg_Soil_Moisture_20_cm_below></Avg_Soil_Moisture_20_cm_below>
                <Avg_Soil_Moisture_50_cm_below></Avg_Soil_Moisture_50_cm_below>
                <Avg_Soil_Moisture_100_cm_below></Avg_Soil_Moisture_100_cm_below>
            </Soil_Moisture>
            <Soil_Temperature>
                <Avg_Soil_Temperature_5_cm></Avg_Soil_Temperature_5_cm>
                <Avg_Soil_Temperature_10_cm></Avg_Soil_Temperature_10_cm>
                <Avg_Soil_Temperature_20_cm></Avg_Soil_Temperature_20_cm>
                <Avg_Soil_Temperature_50_cm></Avg_Soil_Temperature_50_cm>
                <Avg_Soil_Temperature_100_cm></Avg_Soil_Temperature_100_cm>
            </Soil_Temperature>
        </UTC_Date>
    </station_number>
</weather_data>